lesson_id,lesson_theme,nottingham_or_comparator_evidence,bristol_relevance,evidence_strength,transfer_condition,prohibited_overclaim,required_bristol_evidence,current_status,owner
NLR-0001,displaced_parking_cpz,SRC-BCC-0006 lines 2157-2160; SRC-UK-0003 lines 107-108 and 1509-1511,Residential and employment-area spillover must be assessed before boundary or consultation reliance,medium,Boundary options residential street baseline CPZ/RPZ mitigation and monitoring triggers,Nottingham or Leicester proves Bristol displacement scale,Boundary parking inventory displacement model consultation evidence,blocked,Spatial Data Agent
NLR-0002,public_transport_package,SRC-NOTT-0002; SRC-ACADEMIC-0002; SRC-UK-0003,WPL acceptability and impacts depend on credible funded alternatives,medium,Bristol package maturity funding route capacity and benefits attribution,Nottingham public transport benefits will occur in Bristol,Package definition funding assurance model outputs and delivery plan,blocked,Strategic Case Review Agent
NLR-0003,no_charge_transfer,analysis/economic/nottingham-transferability-matrix.csv,Charge level threshold and exemptions must be Bristol-specific,high,Bristol boundary inventory affordability appraisal and consultation evidence,Nottingham charge or threshold is suitable for Bristol,Charge design options ASST EqIA and consultation material,blocked,TAG/Appraisal Review Agent
NLR-0004,no_elasticity_transfer,analysis/economic/nottingham-transferability-matrix.csv; SRC-ACADEMIC-0002,Behavioural response must be modelled with Bristol sensitivity testing,high,Bristol baseline mode share employer mix parking supply and model validation,Nottingham elasticity predicts Bristol response,Model cards run manifests ASR and sensitivity testing,blocked,Analytical Assurance Agent
NLR-0005,evidence_caution,SRC-ACADEMIC-0001 acquisition gap; review/peer_review/stage-1-comparator-evidence-review.md,Independent congestion claims need usable source evidence,high,Acquire usable independent congestion source or omit claim,Nottingham proves congestion reduction for Bristol,Replacement independent source or no congestion-reduction claim,blocked,Comparator Evidence Agent
NLR-0006,employer_support_shadow_year,SRC-NOTT-0001; SRC-NOTT-0002; SRC-BCC-0006,Employer onboarding and compliance support are operational design issues,medium,Bristol employer inventory guidance licensing system appeals route and possible shadow/testing period,Nottingham administration proves Bristol deliverability,Operating model employer support plan and service readiness review,blocked,Operations Design Agent
