check_id,control_area,required_bristol_evidence,linked_lesson_ids,linked_blockers,current_status,owner,no_go_note
NDC-001,residential_street_baseline,Street-level parking occupancy and stress baseline around candidate employment/boundary areas,NLR-0001;NLR-0007,ISS-0003;EG-0014,blocked,Spatial Data Agent,No Bristol displacement scale or mitigation need can be claimed before baseline evidence exists.
NDC-002,boundary_options_displacement,Boundary options tested for nearby free parking and employment-area spillover risk,NLR-0001;NLR-0007,ISS-0003;ISS-0004,blocked,Spatial Data Agent,No boundary option is consultation-ready without displacement testing.
NDC-003,cpz_rpz_options,CPZ/RPZ or alternative parking-control options mapped costed and screened,NLR-0008,ISS-0003;RISK-0004,blocked,Spatial Data Agent,No CPZ/RPZ mitigation is selected costed consulted on or ready.
NDC-004,equality_accessibility,Equality disabled access visitor school hospital and low-income worker impacts assessed,NLR-0001;NLR-0008,ISS-0012;EG-0030,blocked,Equality Review Agent,No equality mitigation can be inferred from Nottingham or comparator material.
NDC-005,monitoring_triggers,Post-launch monitoring metrics thresholds owners and response route defined,NLR-0009,ISS-0006;EG-0023,blocked,Operations Design Agent,No claim that monitoring will solve displacement without thresholds and governance.
NDC-006,employer_behaviour,Employer pass-through relocation compliance and parking-management response tested locally,NLR-0004;NLR-0006,ISS-0004,blocked,Analytical Assurance Agent,No Nottingham employer response can be imported into Bristol.
NDC-007,current_nottingham_refresh,Latest official Nottingham pages reports charge threshold and operating status refreshed,NLR-0010,EG-0008,blocked,Comparator Evidence Agent,No current Nottingham charge or operating status claim from older sources.
